id	sentence	utterance
0	I just have a question. Does Bernadette ever talk about me?	['answer is related to question', 'ask is related to question', 'question is related to answer', 'why is related to question', 'question is related to ask', 'question is related to query', 'answer is the opposite of question', 'question is related to asking']
1	He does it all the time. He's a cornucopia of social awkwardness.	['party is related to social', 'cornucopia is a synonym of profusion', 'cornucopia is a synonym of horn of plenty', 'minute is related to time', 'hour is related to time', 'clock is related to time', 'watch is related to time', 'time is related to clock', 'morning is related to time', 'evening is related to time', 'time is related to minutes', 'gawkiness is a type of awkwardness', 'awkwardness is a type of disadvantage', 'clumsiness is a synonym of awkwardness', 'nuisance value is a synonym of awkwardness', 'awkwardness is a type of unskillfulness', 'ineptitude is a synonym of awkwardness', 'woodenness is a type of awkwardness', 'clumsiness is a synonym of awkwardness']
2	I just want to ask you a few questions about Howard Wolowitz.	['few is not many', 'few is related to little', 'few is the opposite of many', 'few is related to number', 'If you want to get some money from someone then you should ask', 'ask is related to question', 'question is related to ask']
3	Yes. In fact, our menses are synchronized. Penny. Bernadette tells me you're planning a girls' night.	['fact is related to truth', 'fact is related to true', 'fact is a piece of information', 'evening is related to night', 'dream is related to night', 'sleep is related to night', 'night is related to dark', 'moon is related to night', 'day is not night']
4	...so anyway, to make a long story short, turns out I have an unusually firm cervix.	['story is related to tale', 'story is related to book', 'story is related to plot', 'character is related to story', 'a story is for entertainment', 'story is related to novel', 'make is related to create', 'manufacture is related to make', 'offer is related to make', 'produce is related to make', 'build is related to make', 'polish is related to make', 'note is related to short', 'long is the opposite of short', 'dress is related to long', 'ago is related to long', 'rifle is related to long', 'hall is related to long', 'far is related to long', 'rabbit is related to long', 'river is related to long', 'company is related to firm']
5	"Bernadette dared me to tell a dirty story. ""The Miller's Tale"" by Chaucer is the dirtiest story I know. It would have been hidden in sock drawers if people in the 14th century had worn socks."	['story is related to tale', 'story is related to book', 'story is related to plot', 'character is related to story', 'a story is for entertainment', 'story is related to novel', 'You would bathe because you are dirty', 'wash is the opposite of dirty', 'clean is not dirty', 'fourteenth is a synonym of 14th', '14th is similar to ordinal', 'ordinal is similar to 14th', 'century is related to hundred', 'century is related to years', 'century is related to hundred years', 'century is related to time', 'If you want to forgive someone then you should tell them', 'You would mail a letter because you want tell someone something', 'explain is related to tell', 'sock is related to foot', 'sock is related to shoe', 'sock is related to feet', '*Something you find in a drawer is a sock', 'sock is related to clothing', '*Something you find in the sock drawer is a sock', 'sock is related to covering', 'have is related to possess', 'have is related to own', 'must is related to have', 'possess is related to have', 'need is related to have', 'own is related to have']
6	Is it possible that she was going for your cheek and you moved and she accidentally got lip? That happens with me and my mom all the time.	['minute is related to time', 'hour is related to time', 'clock is related to time', 'watch is related to time', 'time is related to clock', 'morning is related to time', 'evening is related to time', 'time is related to minutes', 'a mom can mother her baby', 'mother is related to mom', 'dad is related to mom', 'dad is not mom', 'family is related to mom', 'mom is a synonym of ma', 'a mom is a parent', 'practicable is similar to possible', 'contingent is similar to possible', 'attainable is similar to possible', 'possible is a type of possibility', 'likely is related to possible', 'affirmable is similar to possible', 'possible is similar to attainable']
7	Well, I'm just glad you finally found yourself a keeper.	['keeper is a synonym of custodian', 'prison guard is a type of keeper', 'keeper is a type of defender', 'babysitter is a type of keeper', 'nanny is a type of keeper']
8	Oh, and the science dudes want to talk science with you. What do you want to talk about-- rocks, dinosaurs, our friend the beaver?	"['biology is a science', 'physics is a science', 'You are likely to find a science in a university', 'science is related to chemistry', 'science is related to biology', 'Chemistry is a science', 'science is related to subject', 'science is related to study', 'talk is related to speak', 'Something that might happen when you talk is someone will listen', 'Something that might happen when you talk is open mouth', 'talk is related to communication', 'One of the things you do when you express information is to talk', 'Something you might do while communicating is talk', 'having a conversation requires you to talk', 'One of the things you do when you make a phone call is talk', 'An activity a friend can do is talk', 'Something you might do while enjoying the company of your friends is talk', 'You are likely to find a beaver in a zoo', ""You are likely to find a beaver in a beaver's dam"", 'You are likely to find a beaver in canada', 'need is related to want', 'desire is related to want', 'want is related to desire']"
9	In the bedrooms of ten-year- old girls, where they belong.	['age is related to old', 'record is related to old', 'ancient is related to old', 'old is related to age', 'ruin is related to old', 'old is not young']
10	I don't know. Somebody bigger and... Yeah, sure. Why not you?	['You would find information because you want to know something', 'You would read the news because you want to know', 'You would learn because you want to know something', 'You would read a book because you want to know', 'A stranger is somebody you do not know', 'certain is related to sure']
11	Obviously, we're no longer a Justice League. We have no choice but to switch to our Muppet Baby costumes.	['switch is a synonym of interchange', '*Something you find at a fork in the road is choice', 'choose is related to choice']
12	I understand. Your loyalty is admirable. But what if I were to up the ante?	['admirable is similar to estimable', 'pleasing is similar to admirable', 'Loyalty is a virtue', 'One of the things you do when you play poker is ante', 'ante is used in the context of poker', 'ante is a way to bet on', 'ante is a type of stake', 'playing poker requires an ante', 'ante is used in the context of card game']
13	Certainly. I'd like to raise two points. Number one, I think they <i>are</i> talking about penises. And number two, these mimosas are kicking my little brown ass.	['little is related to small', 'little is related to tiny', 'baby is related to little', 'domestic ass is a type of ass', 'eight is related to number', 'one is related to number', 'age is related to number', 'number is related to digit', 'You are likely to find a number in a phone book', 'number is related to counting', '1 is a number', 'two is a number', 'zero is a number', 'number is related to two', 'You would buy presents for others because you like them', 'like is related to love', 'servant is related to like', 'Something that might happen as a consequence of watching a film is you like it', 'You would entertain someone because you like them', 'like is related to similar', 'love is related to like', 'squirrel is related to like', 'bear is related to brown', 'Brown is a color', 'Eyes can be brown', 'squirrel is related to brown', 'lift is related to raise', 'raise is related to lift', 'raise is related to up', 'raise is related to increase', 'i is related to pronoun']
14	We might be starting to zero in on your problem.	['be is related to exist', 'exist is related to to be', 'being is related to to be', 'a puzzle is a problem', 'trouble is related to problem', 'problem is related to math', 'problem is related to issue', 'problem is related to solution']
15	Hey, you taught me something. Who would have thought it?	['have is related to possess', 'have is related to own', 'must is related to have', 'possess is related to have', 'need is related to have', 'own is related to have']
16	An entire dinner to talk about your research? Where you going, the drive-thru at Jack in the Box?	['plate is related to dinner', 'dinner is a kind of meal', 'napkin is related to dinner', 'Sometimes following a recipe causes dinner', '*Something you find at dinner is bread', '*Something you find at dinner is drinks', 'talk is related to speak', 'Something that might happen when you talk is someone will listen', 'Something that might happen when you talk is open mouth', 'talk is related to communication', 'One of the things you do when you express information is to talk', 'Something you might do while communicating is talk', 'having a conversation requires you to talk', 'One of the things you do when you make a phone call is talk', 'An activity a friend can do is talk', 'Something you might do while enjoying the company of your friends is talk', 'The internet can be used for research', 'Something you need to do before you write a term paper is research', 'Something that might happen while writing a term paper is research', 'If you want to find information then you should research', 'finding information is for research', 'entire is related to whole']
17	Yeah, but you were just sleeping, because I forboded you to have sex.	['Sex is fun', 'Sex is an activity', 'Sometimes sex causes children', 'Sex can be pleasurable', 'Sex is good', 'Sometimes sex causes an orgasm', 'have is related to possess', 'have is related to own', 'must is related to have', 'possess is related to have', 'need is related to have', 'own is related to have']
18	Oh, yeah, yeah. It's real great. Today I drove to Van Nuys for an audition I thought was going to be for a cat food commercial. Turned out to be porn.	['If you want to act in a play then you should audition', 'property is related to real', 'great is related to good', 'great is related to alexander', 'cake is related to food', 'plate is related to food', 'rice is related to food', '*Something you find in the refrigerator is food', 'bread is related to food', 'soup is related to food', 'butter is a food', 'be is related to exist', 'exist is related to to be', 'being is related to to be', 'You are likely to find a cat in my lap', 'You are likely to find a cat in a bed', '*Something you find on the windowsill is a cat', 'Cat can hunt mice', 'A cat has four legs', 'a cat can drink water', 'a cat can catch a mouse', 'cat is related to feline', 'cat is related to animal', '*Something you find on television is a commercial']
19	That's got to be fun for you, huh? Watching Hofstadter suck the saliva out of your sister's mouth?	['sister is related to sibling', 'sister is related to girl', 'sister is related to female', 'sister is related to brother', 'brother is related to sister', 'brother is not sister', 'sister is related to family', '*Something you find in your mouth is saliva', 'be is related to exist', 'exist is related to to be', 'being is related to to be', '*Something you find in your mouth is teeth', '*Something you find in your mouth is your tongue', 'lip is related to mouth', 'taste is related to mouth', 'You are likely to find a tooth in your mouth', 'A mouth has lips', 'napkin is related to mouth']
20	Yeah, it's a great time to be alive, isn't it?	['An animal is alive', 'dead is not alive', 'If you want to breathe then you should be alive', 'a tree is alive', 'trees are alive', 'a plant is alive', 'be is related to exist', 'exist is related to to be', 'being is related to to be', 'minute is related to time', 'hour is related to time', 'clock is related to time', 'watch is related to time', 'time is related to clock', 'morning is related to time', 'evening is related to time', 'time is related to minutes', 'great is related to good', 'great is related to alexander']
21	I'm not saying that you're not fun. You're the most fun person I know.	"['Sex is fun', 'party is related to fun', 'The effect of playing is fun.', 'The effect of playing a game with your friends is fun', 'play is related to fun', 'playing sports is for fun', 'Something that might happen when you play games is fun', 'going to a party is for fun', 'game is related to fun', 'person is related to human', 'A person can cross a street', 'A person can thank another person', 'a person can voice an opinion', 'person can wind clock', 'doll is related to person', 'character is related to person', 'a person wants a headache', 'a person wants clothing', 'A slave is a person', ""a person doesn't want to be diseased""]"
22	Saying that while holding a snowflake is a bit heavy-handed, don't you think?	['a bit is part of a byte', 'bit is related to small', 'bit is related to piece', 'bit is related to little', 'bit is related to drill', 'You are likely to find a snowflake in the winter', 'If you want to contemplate then you should think', 'If you want to create an idea then you should think', 'Something you might do while answering questions is Think', 'One of the things you do when you analyse something is think', 'One of the things you do when you contemplate is think', 'If you want to answer questions then you should think', 'Something you need to do before you talk to someone is think']
23	I'm sorry, Sheldon bought a loom and learned how to weave?	['You can use a loom to weave cloth', 'weave is a way to travel', 'meander is a synonym of weave', 'wander is a synonym of weave', 'brocade is a way to weave', 'regret is related to sorry']
24	Okay, Amy, you're being silly. I'm not concerned about who hangs out with who. And I certainly don't have a problem with Leonard's new girlfriend who wears way too much makeup. Ooh, these are cute. Of course if I buy them, I'll have to rent my womb out to a gay couple.	['You are likely to find a cat in your way', 'door is related to way', 'course is related to golf', 'course is related to class', 'course is related to path', 'course is related to college', 'much is related to lot', 'much is the opposite of little', 'price is related to much', 'Somewhere a baby can be is in the womb', 'womb is a synonym of uterus', 'rent is related to payment', 'rent is related to monthly', 'rent is related to apartment', 'rent is related to lease', 'rent is related to house', 'let is related to rent', 'a couple can tie the knot', 'A couple is two', 'An activity a couple can do is watch a movie', 'a couple can row about anything', 'a puzzle is a problem', 'trouble is related to problem', 'problem is related to math', 'problem is related to issue', 'problem is related to solution', 'makeup is related to face', 'lip-gloss is a type of makeup', 'makeup is a type of event', 'makeup is used for change', 'war paint is a synonym of makeup', 'makeup is used for change', 'Gay is a slang term for homosexual', 'You would get a divorce because you are gay', 'my partner is gay', 'girlfriend is a type of lover', 'squirrel is related to cute', 'puppies and children are cute', 'city is related to new', 'modern is related to new', 'new is not old', 'baby is related to new', 'fresh is related to new', 'have is related to possess', 'have is related to own', 'must is related to have', 'possess is related to have', 'need is related to have', 'own is related to have']
25	Yes, I'd like a seven-day course of penicillin, some, uh, syrup of ipecac-- to induce vomiting-- and a mint.	['course is related to golf', 'course is related to class', 'course is related to path', 'course is related to college', 'induce is used in the context of logic', 'lead is a way to induce', 'ipecac is a type of emetic', 'You would buy presents for others because you like them', 'like is related to love', 'servant is related to like', 'Something that might happen as a consequence of watching a film is you like it', 'You would entertain someone because you like them', 'like is related to similar', 'love is related to like', 'squirrel is related to like', 'penicillinase-resistant antibiotic is a type of penicillin', 'penicillin is a type of antibiotic', 'Penicillin is an antibiotic', 'methicillin is a type of penicillin']
26	"He drank from Leonard's glass. ""He drank from Leonard's glass""-- the words they'll be carving into my tombstone."	['be is related to exist', 'exist is related to to be', 'being is related to to be', 'window is related to glass', 'glass is related to window', 'a glass is used for drinking', 'glass is related to clear', 'glass is related to material', 'A glass can be broken', 'grave is related to tombstone', 'tombstone is a synonym of gravestone']
27	Right, right, whereas Jewish mothers take a casual, la-di-da approach to their sons.	['casual is a synonym of perfunctory', 'casual is a synonym of fooling', 'effortless is a synonym of casual']
28	I gargled with tequila and may have swallowed a teeny bit.	['a bit is part of a byte', 'bit is related to small', 'bit is related to piece', 'bit is related to little', 'bit is related to drill', 'teeny is a synonym of teensy-weensy', 'have is related to possess', 'have is related to own', 'must is related to have', 'possess is related to have', 'need is related to have', 'own is related to have']
29	is an event that's like a heart attack.	['The heart is a muscle', 'home is related to heart', 'a heart is for pumping blood', 'the heart is part of a human body', 'The heart is part of the body', 'a heart is a pump for blood', 'party is related to event', 'birthday is related to event', 'event is related to happening', 'a party is a event', 'A miracle is an event', 'an event can happen to someone', 'attack is related to war', 'attack is related to fight']
30	Your girlfriend and your ex-girlfriend are hanging out together? Oh, yeah, that can only be good for you.	['be is related to exist', 'exist is related to to be', 'being is related to to be', 'girlfriend is a type of lover', 'Sex is good', 'Good can battle evil', 'quality is related to good', 'some people are good', 'Good is the opposite of Evil', 'great is related to good', 'cake is related to good', 'excellent is related to good']
31	I'd like to respond to that sarcastically: Yes, I relish the thought of a stranger covering my body with oil and rubbing it.	['body is related to human', 'head is related to body', 'hand is related to body', 'eye is related to body', 'leg is related to body', 'bone is related to body', 'body is related to person', 'reply is related to respond', 'idea is related to thought', 'creating an idea requires some thought', 'dream is related to thought', 'You would buy presents for others because you like them', 'like is related to love', 'servant is related to like', 'Something that might happen as a consequence of watching a film is you like it', 'You would entertain someone because you like them', 'like is related to similar', 'love is related to like', 'squirrel is related to like', 'oil is related to liquid', 'oil is related to black', 'oil is related to fuel', 'oil is related to petroleum', 'oil is related to crude', 'oil is related to gasoline', 'You are likely to find oil in the ground', 'oil is related to gas', 'oil is related to gold', 'a stranger is for meeting', 'A stranger is somebody you do not know', 'stranger is related to person']
32	Congratulations and welcome temporarily aboard. Here's your I.D. card, your key and your lapel pin. Which Leonard was too cool to wear.	['tack is related to pin', 'A key can open a lock', 'a key can open doors', 'You can use a key to open a lock', 'a key is used for opening doors', '*Something you find in a pocket is a key', 'key can start car', 'a key is for opening a lock', 'You are likely to find a key in keychain', 'a key is used for unlocking', 'dress is related to wear', 'crown is related to wear', 'sock is related to wear', 'shoe is related to wear', 'lapel is a type of lap', 'card is related to paper', 'card is related to greeting', 'card is related to deck', 'card is related to playing', 'card is related to birthday', 'card is related to poker', 'You are likely to find a card in a deck', 'card is related to game', 'The first thing you do when you have friends over is welcome them', 'shade is related to cool', 'You would get wet because you want to be cool']
33	Of course you do. You're a cutie pie! Any girl would be lucky to have you!	['daughter is related to girl', 'doll is related to girl', 'girl is related to female', 'chick is related to girl', 'girl is related to young', 'sister is related to girl', 'boy is related to girl', 'girl is related to woman', 'boy is not girl', 'course is related to golf', 'course is related to class', 'course is related to path', 'course is related to college', 'lucky is related to fortunate', 'lucky is similar to apotropaic', 'cake is related to pie', 'apple is related to pie', '*Something you find in the oven is a pie', '*Something you find on the windowsill is a pie', 'be is related to exist', 'exist is related to to be', 'being is related to to be', 'have is related to possess', 'have is related to own', 'must is related to have', 'possess is related to have', 'need is related to have', 'own is related to have']
34	Oh, I could so see you being the face of hemorrhoids.	['eye is related to see', 'look is related to see', 'view is related to see', 'a person wants to see', 'window is related to see', 'clear is related to see', 'glass is related to see', 'eye is related to face', 'nose is related to face', 'You are likely to find a nose in your face', 'face is related to head', 'head is related to face', 'face is related to eyes', 'face is related to nose', 'mouth is related to face']
35	"All right, so technically it's not a dinner date. I suppose you could call it a, uh, dinfast date. But if you did, you'd open yourself to peer-based mocking, such as, ""Hey, Leonard, how was your dinfast with Priya last night?"""	['plate is related to dinner', 'dinner is a kind of meal', 'napkin is related to dinner', 'Sometimes following a recipe causes dinner', '*Something you find at dinner is bread', '*Something you find at dinner is drinks', 'If you want to read the newspaper then you should open it', 'door is related to open', 'wound is related to open', 'a door can open.', 'If you want to read a book then you should open it', 'field is related to open', 'last is a synonym of in conclusion', 'last is similar to ultimate', 'dying is similar to last', 'evening is related to night', 'dream is related to night', 'sleep is related to night', 'night is related to dark', 'moon is related to night', 'day is not night', 'much is similar to such', 'playful is similar to mocking', 'mocking is a synonym of derisive', 'mocking is similar to playful', 'teasing is a synonym of mocking', 'quizzical is a synonym of mocking', 'call is related to phone', 'call is related to telephone', 'You would remember a phone number because you want to call someone', 'call is related to ring', 'call is related to action', 'If you want to meet a friend then you should call them', 'turn is related to right', 'a person wants to be right', 'right is related to direction', 'right is related to correct', 'birthday is related to date', 'due is related to date', 'date is related to calendar', 'date is related to day']
36	When you're done copping a feel, that goes on my wrist.	['watch is related to wrist', 'hand is related to wrist', 'touch is related to feel', 'feel is related to touch', 'feel is related to sense']
37	Because you don't have a girlfriend? Well, good Lord, if that becomes a reason not to play Dungeons & Dragons, this game's in serious trouble.	['intellectual is similar to serious', 'serious is similar to serious-minded', 'difficult is similar to serious', 'serious is similar to difficult', 'solid is similar to serious', 'serious is similar to overserious', 'Polo is a game', 'football is a type of game', 'Baseball is a game', 'Chess is a game', 'game is related to play', 'game is related to fun', 'Sex is good', 'Good can battle evil', 'quality is related to good', 'some people are good', 'Good is the opposite of Evil', 'great is related to good', 'cake is related to good', 'excellent is related to good', 'purpose is related to reason', 'because is related to reason', 'cause is related to reason', 'trouble is related to bad', 'trouble is related to problem', 'danger is related to trouble', 'girlfriend is a type of lover', 'You would play because you want to have some fun', 'play is related to fun', 'toy is related to play', 'game is related to play', 'play is related to activity', 'play is related to game', 'have is related to possess', 'have is related to own', 'must is related to have', 'possess is related to have', 'need is related to have', 'own is related to have']
